House Party,Sam Hunt,"You're on the couch, blowin' up my phone
You don't want to come out, but you don't want to be alone
It don't take but two to have a little soirée
If you're in the mood sit tight right where you are, babe

'Cause I'll be at your door in ten minutes
Whatever you got on, girl, stay in it
You ain't gotta leave the house to have a good time
I'm gonna bring the good time home to you

We'll have a house party, we don't need nobody
Turn your TV off, break that boom-box out
We'll wake up all the neighbors 'til the whole block hates us
And the cops show up and try to shut us down

If you're gonna be a homebody
We're gonna have a house party
If you wanna be a homebody
We're gonna have a house party

Throw a neon tee shirt over the lamp shade
I'll take the furniture, slide it out of the way
Shakin' the floor, rattlin' the roof (roof's on fire)
We'll go to town like they're in your livin' room

Let's have a house party, we don't need nobody
Turn your TV off, break that boom-box out
We'll wake up all the neighbors 'til the whole block hates us
And the cops show up and try to shut us down

If you're gonna be a homebody
We're gonna have a house party
If you wanna be a homebody
We're gonna have a house party

So I'll be at your door in ten minutes

Whatever you got on, baby, stay in it
You ain't gotta leave the house to have a good time
I'm gonna bring the good time home to you

We'll have a house party, we don't need nobody
Turn your TV off, break that boom-box out
We'll wake up all the neighbors 'til the whole block hates us
And the cops show up and try to shut us down

If you're gonna be a homebody
We're gonna have a house party
If you wanna be a homebody
We're gonna have a house party",Country
Hell Of A Night,Dustin Lynch,"All we need is a July hot Saturday night
A couple cans all cool and the needle on full and a countryside
Yeah, a hot little playlist, every favorite songs
When I get you climbing up in the cab of this truck
Yeah you know it's on, know it's on

Show you a side of these two lanes you've never seen
Heating it up behind a high beam
Ooh, baby you and me, just a-running down crazy
Flying high, living careless, on the edge of wild and reckless
Hold on tight, I'm 'bout to show you one hell of a night

So give me that aw yeah, and take me there look
I'm a sucker for your kiss, wanna steal 'em from your lips baby, like a truck
Foot heavy on the floorboard, everywhere we go
I'm talking once in a lifetime, blowing your mind
Burning down these back roads

Show you a side of these two lanes you've never seen
Heating it up behind a high beam
Ooh, baby you and me, just a-running down crazy
Flying high, living careless, on the edge of wild and reckless
Hold on tight, I'm 'bout to show you one hell of a night

So give me that aw yeah, and I'll give you that all night
Girl, give me that let's go, and I'll give you that good good time

Show you a side of these two lanes you've never seen
Heating it up behind a high beam
Ooh, baby you and me, just a-running down crazy
Flying high, living careless, on the edge of wild and reckless
Hold on tight, I'm 'bout to show you one hell of a night
Yeah, a once in a lifetime night
Ooh girl, looking down the ride of one hell of a night
I'm 'bout to show you one hell of a night",Country
Can't Feel My Face  ,The Weeknd,"And I know she'll be the death of me, at least we'll both be numb
And she'll always get the best of me, the worst is yet to come
But at least we'll both be beautiful and stay forever young
This I know, yeah, this I know

She told me, ""Don't worry about it""
She told me, ""Don't worry no more""
We both know we can't go without it
She told me you'll never be in love, oh, oh, woo

I can't feel my face when I'm with you
But I love it, but I love it, oh

I can't feel my face when I'm with you
But I love it, but I love it, oh
And I know she'll be the death of me, at least we'll both be numb
And she'll always get the best of me, the worst is yet to come

All the misery was necessary when we're deep in love
This I know, girl, I know
She told me, ""Don't worry about it""
She told me, ""Don't worry no more""

We both know we can't go without it
She told me you'll never be in love, oh, oh, woo

I can't feel my face when I'm with you
But I love it, but I love it, oh

I can't feel my face when I'm with you
But I love it, but I love it, oh
I can't feel my face when I'm with you
But I love it, but I love it, oh

I can't feel my face when I'm with you
But I love it, but I love it, oh
She told me, ""Don't worry about it""
She told me, ""Don't worry no more""
We both know we can't go without it
She told me you'll never be in love, oh, oh, woo
I can't feel my face when I'm with you
But I love it, but I love it, oh
I can't feel my face when I'm with you
But I love it, but I love it, oh",R&B/Soul
This Could Be Us,Rae Sremmurd,"Na, na, na, na, na, na, na, na Hey, Sremm life

I've done it before, I've seen it before
Tears splashin' the floor when I opened the door for her
She acted like a whore and I'ma let her
Learn from Project Pat uh pimpin' got her masters
Girl, improvise, look me in my eyes and lie to me
Lie to me, act like I'll believe anything
Sex on the beach and in the backseat
This could be us

So back to what I was saying (Money make the world go round)
This could be us but you're playing, (Money make your girl go down)
This could be us but you're playing, (Money make the world go round)
I'm high, I hope I don't sound crazy (Money make your girl go down)
Fuck what them niggas were saying, (Money make the world go round)
This could be us but you playing, (Money make your girl go down)
This could be us but you playing, (Money make the world go round)
But shit, that's all I was saying (Money make your girl go down)
(And that's just how it goes)

New keys to drive this Mercedes
I ball like Tracy McGrady
Before I let a girl touch anything
She gotta say please, say please
And I know they really wish we would ball til we fall
I'm the big bad wolf there's a full moon y'all
Toss the money in the air girl, watch how your dreams hit the floor
Wait til I get the buzz off this drug
Damn girl, you way too fine for a local club
Killin' someone's vibes should be a fuckin' crime
Wasting someone's time should be a fuckin' crime

So back to what I was saying (Money make the world go round)
This could be us but you're playing, (Money make your girl go down)
This could be us but you're playing, (Money make the world go round)
I'm high, I hope I don't sound crazy (Money make your girl go down)
Fuck what them niggas were saying, (Money make the world go round)
This could be us but you playing, (Money make your girl go down)
This could be us but you playing, (Money make the world go round)
But shit, that's all I was saying (Money make your girl go down)
(And that's just how it goes)

Spin the bottle, spin the fuckin' bottle
If you the reason why it's empty, baby, spin the bottle
Truth or dare, no, you don't want no problem
Spin the bottle, spin the fuckin' bottle
If you the reason why its empty baby, spin the fuckin' bottle
Truth or dare, no, no, you don't want no problem
You don't want no problem
Bitch you might as well party

So back to what I was saying (Money make the world go round)
This could be us but you're playing, (Money make your girl go down)
This could be us but you're playing, (Money make the world go round)
I'm high, I hope I don't sound crazy (Money make your girl go down)
Fuck what them niggas were saying, (Money make the world go round)
This could be us but you playing, (Money make your girl go down)
This could be us but you playing, (Money make the world go round)
But shit, that's all I was saying (Money make your girl go down)
(And that's just how it goes)
Money make the world go round
Money make your girl go down",Hip-Hop/Rap
Lose My Mind,Brett Eldredge,"You put me on a roller coaster, fly me on a plane
You send me to another planet, get inside my brain
I knew right when I met you I would never be the same
But I let you take me over, Girl, so I'm the one to blame Oh

You…Make all my screws come….loose Got me perfectly con….fused
Always to find a way to mess me up and drive me wild
I love the way you make me lose my mind
Lose my mind
You make me crazy and I kinda like it

You show me that apple girl and I want to bite it
So crazy that I gotta have it
and I never wanna get out of this straitjacket
You…Make all my screws come….loose

Got me perfectly con….fused
Always to find a way to mess me up and drive me wild
I love the way you make me lose my…
I feel the walls closing in inside this padded room

Only good thing about it is I'm locked in here with you, yeah
I'm always watching you, wondering what you'll do next
But my favorite part about it is I always have to guess (you know i do)
You…Make all my screws come….loose
Got me perfectly con….fused

Always to find a way to mess me up and drive me wild
I love the way you make me lose my mind
Make me Lose my mind
Lose my mind
Make me lose my mind
make me lose my mind
Lose my mind",Country
Ghost Town  ,Adam Lambert,"Died last night in my dreams
Walking the streets
Of some old ghost town
I tried to believe
In God and James Dean
But Hollywood sold out

Saw all of the saints
Lock up the gates
I could not enter
Walked into the flames
Called out your name
But there was no answer

And now I know my heart is a ghost town
My heart is a ghost town
My heart is a ghost town
My heart is a ghost town

Died last night in my dreams
All the machines
Had been disconnected
Time was thrown at the wind
And all of my friends
Had been disaffected

Now, I'm searching for trust
In a city of rust
A city of vampires
Tonight, Elvis is dead
And everyone's spread
And love is a satire

And now I know my heart is a ghost town
My heart is a ghost town
My heart is a ghost town
My heart is a ghost town

There's no one left in the world
I'm gunslingin'
Don't give a care if I go
Down, down, down
I got a voice in my head that keeps singing
Oh, my heart is a ghost town
My heart is a ghost town
Oh, my heart is a ghost town
(Said, my heart)
My heart is a ghost town
My heart is a ghost town",Pop
Sparks  ,Hilary Duff,"I can't hear a single word
Just know you're talking ‘cause your lips keep moving
Everything I thought I learned
Goes out the window
All I want is one thing

You can promise castles, treasures, babies
I don't care
Cause for now you're just enough for me
I want you near
Like a fairytale to feel your breath right on my neck
You remember what I love so baby take me back

Turn the lights down low and kiss me in the dark
Cause when you're touching me baby I see sparks
You make my heart go
You
You, you make my heart go
You
You, you make my heart go

Ticking tocking like a bomb
Throws me back to when I had you closer
Skin to skin we get it on

Without the love I feel you going bolder
You can promise castles, treasures, babies
I don't care
Cause for now you're just enough for me
I want you near
Like a fairytale to feel your breath right on my neck

You remember what I love so baby take me back
Turn the lights down low and kiss me in the dark
Cause when you're touching me baby I see sparks
You make my heart go
You
You, you make my heart go
You

You, you make my heart go

Take it all off
Want every inch of you
Traveling back in time
Tangled uptight

Just like we used to
Now do that thing I like
Turn the lights down low and kiss me in the dark
Cause when you're touching me baby I see sparks
You make my heart go
You
You, you make my heart go
You
You, you make my heart go",Pop
Real Life,Jake Owen,"Well I grew up in a real town
Where the prom queen had a plastic crown
And we really did just drive around
‘Cause there wasn't sh! t to do
We didn't know we were real broke
Daddy rolled them real smokes
We drank RC, no real Coke
But our neighbor had a pool

We got green grass and two trees
Whoa oh oh oh oh
But it ain't like what's on TV
Whoa oh oh oh oh
This is real life in the real world
We ain't talking to no models
We got real girls
We get real low, we get real high
It ain't all good baby but it's all right
Real life

We got a dive bar
With a real band, they play too loud
And they're real bad
But we're real boys so we still dance
And we stay out way too late
Hit the Waffle House for some real food
But that waitress, she's real rude
She got real problems but we do too so we tip her anyway

That's just the way that it is Whoa oh oh oh oh
That's just the way that we live Whoa oh oh oh oh
This is real life in the real world
We ain't talking to no models
We got real girls
We get real low, we get real high
It ain't all good baby but it's all right
Real life
Yeah we're livin' real life

We find real love, get real hurt
Fall real hard, shake off the dirt
Pray to God, let's make a deal
I guess it just got real
We get real low, we get real high
It ain't all good baby but it's all right
Real life
This ain't no fairy tale, it's real life",Country
Like I Can  ,Sam Smith,"He could be a sinner, or a gentleman
He could be your preacher, when your soul is damned
He could be your lawyer on a witness stand, but
He'll never love you like I can, can

He could be a stranger, you gave a second glance
He could be a trophy, of a one night stand
He could have your humour, but I don't understand 'cause
He'll never love you like I can, can, can

Why are you looking down on the wrong road
Mine is the heart, and the soul of this song
There may be lovers who hold out their hands but
He'll never love you like I can, can, can
He'll never love you like I can, can

A chance encounter of circumstance
maybe, he's a mantra, keeps your mind entranced
He could be a silence in this mayhem, but then again
He'll never love you like I can, can, can

Why are you looking down on the wrong road
Mine is the heart, and the soul of this song
There may be lovers who hold out their hands but
He'll never love you like I can, can, can
He'll never love you like I can, can, can

He'll never love you like I can, can, can

We both have demons, that we can't stand
I love your demons, like devils can
If you're still seeking an honest man
Stop deceiving, Lord, please
Why are you looking down on the wrong road
Mine is the heart, and the soul of this song
There may be lovers who hold out their hands but
He'll never love you like I can, can, can
He'll never love you like I can, can, can
He'll never love you like I can, can, can",Pop
Check,Young Thug,"I can see that bullshit from a mile away
You can stack my money about a mile away
I got three white bitches like it's powder day
Mink coat with the rolls like a Shar Pei
And all my bitches sexy, call them Barbies
She lookin' back like I'm flexin', baby no way
And lately I've been on that D'usse
I got me a check, I got a check
Y'all, I done got me a check, I got a check
Y'all, I done got me a check, I got a check

Y'all, I done got me a check, I got a check
Money on my mind, I got money on my brain
Money in my pants, I got money, I call change
20, 50, 100, 5, all the millions made
Big hundred dollar, screamin' free Gucci Mane
If I need some racks I'mma flip me some packs
I talk like I want and she don't say nothin' back

If cops pull up I put that crack in my crack

Or I put that brack in my brack
Call little shawty, made her fuck on my brodie
If you don't owe me bitch still act like you owe me
I promise I won't ever quit bitch, I'm Kobe
And I wear that white, you can snow me
Stoner Young Thugger
I whip it that bitch yeah she know me Young Thugger
Yeah, she stuntin' like butter
The bitch from Chicago, I call her young Cutler
Leave it to Beaver
I pull up in Bentleys with London, they all want to meet 'em
Yeah, they all wanna greet 'em
They pull down they pants and they all wanna eat 'em
No they won't tease on that dick
They won't read on that dick, they won't leash on that dick
No Felicia that dick, Mamacita that dick
They gone snitch on that dick
And she screamin' loud, she can't secret that dick
Mama a beast on that dick
If she bad, I'm gonna Four Season that bitch
Eat that lil bitch, I'mma feast that lil bitch
I got me a check, I got a check

Yall, I done got me a check, I got a check
Yall, I done got me a check, I got a check

Yall, I done got me a check, I got a check
Money on my mind, I got money on my brain
Money in my pants, I got money, I call change
20, 50, 100, 5, all the millions made
Big hundred dollar, screamin' free Gucci Mane

Bitch I'm a Migo, I play with kilo
When I put ice on, I am sub zero
All of my niggas, they hard, call 'em beetles

Niggas was fake so I kept me a Ruger and reagles
Droppin' the top on the Bentley, I'm with the Birdman, yeah the eagle
Geeked out my mind, man I'm tripping out
I don't know none of these people
Hey my little shawty, go get me a four and bring back me a liter
Yes, I got drugs, I'm not worried about that

They know they can get wet and I swear
I got me a check, I got a check
Yall, I done got me a check, I got a check
Yall, I done got me a check, I got a check
Yall, I done got me a check, I got a check
Money on my mind, I got money on my brain
Money in my pants, I got money, I call change
20, 50, 100, 5, all the millions made
Big hundred dollar, screamin' free Gucci Mane",Hip-Hop/Rap
Cool For The Summer,Demi Lovato,"Tell me what you want
What you like
It's okay
I'm a little curious too
Tell me if it's wrong, if it's right
I don't care
I can keep a secret, can you?

Got my mind on your body and your body on my mind
Got a taste for the cherry, I just need to take a bite
Don't tell your mother
Kiss one another
Die for each other
We're cool for the summer
(Ha)

(Ooh, Ooh)
Take me down into your paradise
Don't be scared, cause I'm your body type
Just something that we wanna try
Cause you and I
We're cool for the summer

Tell me if I won
If I did, what's my prize?
I just wanna play with you too
Even if they judge, fuck it, I'll do the time
I just wanna have some fun with you

Got my mind on your body and your body on my mind
Got a taste for the cherry, I just need to take a bite
Don't tell your mother
Kiss one another
Die for each other
We're cool for the summer
(Ha)

(Ooh, Ooh)
Take me down into your paradise
Don't be scared, cause I'm your body type
Just something that we wanna try
Cause you and I
We're cool for the summer
(Ha)
We're cool for the summer
We're cool for the summer

Shhhh... don't tell your mother
Got my mind on your body and your body on my mind
Got a taste for the cherry, I just need to take a bite
Take me down

Take me down into your paradise
(Done be scared) Don't be scared, cause I'm your body type
Just something that we wanna try (wanna try)
Cause you and I (you and I)
We're cool for the summer

(Take me down) We're cool for the summer
(Don't be scared) cause I'm your body type
(Just something) Just something that we wanna try
Cause you and I (you and I)
We're cool for the summer
(Ha) Ooh
We're cool for the summer",Pop
Love Is Your Name,Steven Tyler,"Send your kisses my way
Bring your sweet heart to me
I've been waiting for so long

Tell me all your stories
Leave some open for me
Write your name into this song

I walk through the fire
Run through the rain
I'll wait for forever
If love is your name

Catch your wind from heaven
Send them while you're sleeping
Wake me with the morning sun
I'll dream of you until you come

I walk through the fire
Run through the rain
I'll wait for forever
If love is your name

Valentines keep knocking
My heart keeps on walking
Darling I'll hold on for you
For You, for you

I'll walk through the fire
I'll run through the rain
I'll wait for forever
If love is your name

If love is your name
If love is your name",Country
Lord Knows  ,Meek Mill,"All I wanted was a new Mercedes
Bending off the corner whipping out the lot, I got it
Women love me but the niggas hate it
But how can I lose when I came from the bottom
Lord knows, nigga lord knows, nigga lord knows, nigga lord knows
Nigga lord knows, nigga lord knows, nigga lord knows
Nigga lord knows, nigga lord knows, nigga lord knows

Lord knows I'm filthy rich
All this ice is like 50 bricks
Rap niggas throwing hissy fits
I give my bitch a stack just for a Christmas gift
My bitch so bad she on my Christmas list
Remember I prayed I really wished for this
To get the crib with the maid and with the picket fence
I with some niggas that remember we took some risks for this
I'm talking risky business flick the wrist
Lord knows that I repent for this
But Lord knows that if I get penned for this
I prolly won't get home until I'm 56
They said I'm the Messiah, you rappers is liars
I sign up at church just to rap at the choir
They spit my new verse at your wake while you're lying
The middle of the church at your wake, no I'm lying
I just came from jail, ain't do no crying
They put me through hell, sharpened my iron
I did my push-ups and roared with the lions
Like hold up, from balling I'm tired
I'm back in this bitch and I'm back on my shit
Man they tell me be humble I'm cocky as hell
Shout out my bitches that answered my calls
When I called to collect cause it got me through hell
Shout out that judge that denied me my bail
It made me smarter and made me go harder
They locked me up and slowed my album up but I did not give up
Cause I knew I would prevail
Came in the game Philly as shit
Look at these rappers they silly as shit
I do not know why they be gassing these suckers
But fuck 'em because I am not feeling their shit
Difference between me and most of these rappers
I'm talking about work that I really put in
Talking about pistols I put on my hip
And I'm talking about foreigns I really could whip
That I really done drove
Really was froze in my hood and these bitches I really did hit
Really was chose came up from nothing
And now they like how he make millions so quick
I'm in the back and it feel like a sofa
I done seen bitches I'm fuckin' on Oprah
In my new mansion I feel like I'm Sosa
A brick on the table ain't sniffing no coca

No way

All I wanted was a new Mercedes
Bending off the corner, whipping out the lot, I got it
Women love me but the niggas hate it
But how can I lose when I came from the bottom?
Lord knows, nigga lord knows, nigga lord knows, nigga lord knows

Nigga lord knows, nigga lord knows, nigga lord knows
Nigga lord knows, nigga lord knows, nigga lord knows

Niggas can't see me with binoculars on
Back of the Maybach, shottas on
And all my niggas keep choppers on
Don't reach round me that's a chopper zone
Every time you be on count, what the topic on?
250 thou what I dropped it on
See y'all think it's a game 'til Fox be on
Seeing then momma picking out boxes for 'em
I want everything got my own boxers on
Own headphones to get my popping on
I got my own Pumas that I designed 'em for 'em
Steady moving on these niggas get my boxing on
All I ever hear from niggas what they prolly doing
But they be really talkin' 'bout what I be doing
All black Rottweiler that Givenchy on
Drop top Rolls Royce but the top is on
And the windows down like see y'all later
Mirror tint on that bitch so you could see y'all hating
Champagne cork pop like we all made it
Ya'll looking from the sideline we all hate it
Money don't make it real
Don't give a fuck if its 80 mil, pussy
And just cause you got a Bentley
That Bentley won't make you trill, pussy
Still hating me from my city
I'm thinking is they for real, pussies
Cause all I got to say is kill
They'll come in like Navy Seals
That's word to my momma, I promise I ain't doing no block
And we shoot at you robbers and kill all you fuck niggas talking
Lately I've been on this money
Don't run it back up just to come and put you in a coffin
I heard you said you was running this city

I seen you in traffic and you was just walking
Niggas be popping that shit like they with it
When niggas start hitting all you did was talk it, you pussy

All I wanted was a new Mercedes
Bending off the corner, whipping out the lot, I got it
Women love me but the niggas hate it
But how can I lose when I came from the bottom?
Lord knows, nigga lord knows, nigga lord knows, nigga lord knows
Nigga lord knows, nigga lord knows, nigga lord knows
Nigga lord knows, nigga lord knows, nigga lord knows",Hip-Hop/Rap
Ex's & Oh's,Elle King,"Well, I had me a boy, turned him into a man
I showed him all the things that he didn't understand
Whoa, and then I let him go

Now, there's one in California who's been cursing my name
'Cause I found me a better lover in the UK
Hey, hey, until I made my getaway

One, two, three, they gonna run back to me
'Cause I'm the best baby that they never gotta keep
One, two, three, they gonna run back to me
They always wanna come, but they never wanna leave

Ex's and the oh, oh, oh's they haunt me
Like gho-o-osts they want me to make 'em all
They won't let go
Ex's and oh's

I had a summer lover down in New Orleans
Kept him warm in the winter, left him frozen in the spring
My, my, how the seasons go by

I get high, and I love to get low
So the hearts keep breaking, and the heads just roll
You know that's how the story goes

One, two, three, they gonna run back to me
'Cause I'm the best baby that they never gotta keep
One, two, three, they gonna run back to me
They always wanna come, but they never wanna leave

Ex's and the oh, oh, oh's they haunt me
Like gho-o-osts they want me to make 'em all
They won't let go

My ex's and the oh, oh, oh's they haunt me
Like gho-o-osts they want me to make 'em all
They won't let go
Ex's and oh's

One, two, three, they gonna run back to me
Climbing over mountains and a-sailing over seas
One, two, three, they gonna run back to me
They always wanna come, but they never wanna leave

My ex's and the oh, oh, oh's they haunt me
Like gho-o-osts they want me to make 'em all
They won't let go

Ex's and the oh, oh, oh's they haunt me
Like gho-o-osts they want me to make 'em all
They won't let go
Ex's and oh's",Alternative
